CID;NAME;COUNTRY;INDUSTRY;SECTOR;REQUIREMENTS;PREFERENCES
ORG000334;Novartis AG;Switzerland;Biopharmaceuticals;Pharmaceuticals;Favorable Tax Incentives, Low Production Costs, High Drug Pricing Power;Stable R&D Funding, Sustainable Profit Margins, Strong Patent Protection
ORG000335;Teva Pharmaceutical Industries Ltd.;Israel;Generic Drugs;Pharmaceuticals;Sustainable Profit Margins, Stable R&D Funding, Strong Patent Protection;Favorable Tax Incentives, Strong Patent Protection, High Drug Pricing Power
ORG000336;Sandoz (a Novartis division);Switzerland;Generic Drugs;Pharmaceuticals;Stable R&D Funding, Strong Patent Protection, Low Production Costs;Favorable Tax Incentives, Strong Patent Protection, Sustainable Profit Margins
ORG000337;Mylan N.V. (now part of Viatris);United States;Generic Drugs;Pharmaceuticals;High Drug Pricing Power, Favorable Tax Incentives, Strong Patent Protection;High Drug Pricing Power, Low Production Costs, Stable R&D Funding
ORG000338;Sun Pharmaceutical Industries Ltd.;India;Generic Drugs;Pharmaceuticals;Sustainable Profit Margins, Favorable Tax Incentives, Stable R&D Funding;Stable R&D Funding, Favorable Tax Incentives, Strong Patent Protection
ORG000339;GlaxoSmithKline plc (GSK);United Kingdom;Vaccines;Pharmaceuticals;Strong Patent Protection, Sustainable Profit Margins, Favorable Tax Incentives;Favorable Tax Incentives, Sustainable Profit Margins, High Drug Pricing Power
ORG000340;Sanofi S.A.;France;Vaccines;Pharmaceuticals;Strong Patent Protection, Sustainable Profit Margins, Low Production Costs;Stable R&D Funding, Sustainable Profit Margins, Low Production Costs
ORG000341;Merck & Co., Inc.;United States;Vaccines;Pharmaceuticals;Sustainable Profit Margins, Favorable Tax Incentives, Strong Patent Protection;Sustainable Profit Margins, Favorable Tax Incentives, High Drug Pricing Power
ORG000342;Moderna, Inc.;United States;Vaccines;Pharmaceuticals;Sustainable Profit Margins, Low Production Costs, Stable R&D Funding;Stable R&D Funding, Sustainable Profit Margins, Low Production Costs
ORG000343;Johnson & Johnson;United States;OTC Medicines;Pharmaceuticals;Stable R&D Funding, Low Production Costs, High Drug Pricing Power;Favorable Tax Incentives, High Drug Pricing Power, Low Production Costs
ORG000344;Bayer AG;Germany;OTC Medicines;Pharmaceuticals;Strong Patent Protection, Stable R&D Funding, Sustainable Profit Margins;High Drug Pricing Power, Strong Patent Protection, Favorable Tax Incentives
ORG000345;Reckitt Benckiser Group plc;United Kingdom;OTC Medicines;Pharmaceuticals;Favorable Tax Incentives, Stable R&D Funding, Sustainable Profit Margins;Stable R&D Funding, High Drug Pricing Power, Strong Patent Protection
ORG000346;Procter & Gamble Co.;United States;OTC Medicines;Pharmaceuticals;Favorable Tax Incentives, Strong Patent Protection, Sustainable Profit Margins;Stable R&D Funding, Favorable Tax Incentives, High Drug Pricing Power
ORG000347;CBRE Group;United States;Commercial Real Estate;Real Estate;AI-powered real estate matching, Green retrofitting programs, Automated rental pricing models;Green retrofitting programs, Automated rental pricing models, AI-powered real estate matching
ORG000348;Cushman & Wakefield;United States;Commercial Real Estate;Real Estate;Fractional property investment, Co-living and co-working spaces, AI-powered real estate matching;AI-powered real estate matching, Community-driven urban design, Green retrofitting programs
ORG000349;JLL (Jones Lang LaSalle);United States;Commercial Real Estate;Real Estate;AI-powered real estate matching, Green retrofitting programs, Automated rental pricing models;AI-powered real estate matching, Green retrofitting programs, Co-living and co-working spaces
ORG000350;Savills;United Kingdom;Commercial Real Estate;Real Estate;Automated rental pricing models, Co-living and co-working spaces, Community-driven urban design;AI-powered real estate matching, Automated rental pricing models, Co-living and co-working spaces
ORG000351;Coldwell Banker;United States;Residential Real Estate;Real Estate;Fractional property investment, Co-living and co-working spaces, Community-driven urban design;Co-living and co-working spaces, Fractional property investment, Community-driven urban design
ORG000352;Keller Williams Realty;United States;Residential Real Estate;Real Estate;Automated rental pricing models, Co-living and co-working spaces, Green retrofitting programs;Co-living and co-working spaces, Fractional property investment, Green retrofitting programs
ORG000353;RE/MAX;United States;Residential Real Estate;Real Estate;Green retrofitting programs, Co-living and co-working spaces, Community-driven urban design;AI-powered real estate matching, Community-driven urban design, Fractional property investment
ORG000354;Zillow Group;United States;Residential Real Estate;Real Estate;Green retrofitting programs, Automated rental pricing models, AI-powered real estate matching;Fractional property investment, Community-driven urban design, Green retrofitting programs
ORG000355;Brookfield Asset Management;Canada;Property Development;Real Estate;Fractional property investment, Automated rental pricing models, Co-living and co-working spaces;Automated rental pricing models, Community-driven urban design, Fractional property investment
ORG000356;Country Garden Holdings;China;Property Development;Real Estate;Fractional property investment, Green retrofitting programs, Community-driven urban design;Automated rental pricing models, Community-driven urban design, Green retrofitting programs
ORG000357;Dalian Wanda Group;China;Property Development;Real Estate;Green retrofitting programs, AI-powered real estate matching, Co-living and co-working spaces;Fractional property investment, Co-living and co-working spaces, Community-driven urban design
ORG000358;Mitsui Fudosan;Japan;Property Development;Real Estate;Automated rental pricing models, AI-powered real estate matching, Green retrofitting programs;AI-powered real estate matching, Co-living and co-working spaces, Automated rental pricing models
ORG000359;American Tower Corporation;United States;REITs;Real Estate;Community-driven urban design, AI-powered real estate matching, Automated rental pricing models;Co-living and co-working spaces, Fractional property investment, AI-powered real estate matching
ORG000360;Equity Residential;United States;REITs;Real Estate;Green retrofitting programs, AI-powered real estate matching, Fractional property investment;AI-powered real estate matching, Community-driven urban design, Co-living and co-working spaces
ORG000361;Prologis;United States;REITs;Real Estate;Green retrofitting programs, Community-driven urban design, Automated rental pricing models;AI-powered real estate matching, Fractional property investment, Community-driven urban design
ORG000362;Simon Property Group;United States;REITs;Real Estate;Automated rental pricing models, Co-living and co-working spaces, Green retrofitting programs;AI-powered real estate matching, Automated rental pricing models, Fractional property investment
ORG000363;Alibaba Group;China;E-commerce;Retail;Sustainable resale platforms, Dynamic pricing optimization, Subscription-based retail models;Sustainable resale platforms, Blockchain for supply chain transparency, Subscription-based retail models
ORG000364;Amazon;United States;E-commerce;Retail;AI-powered in-store assistants, Blockchain for supply chain transparency, Dynamic pricing optimization;Subscription-based retail models, Blockchain for supply chain transparency, AI-powered in-store assistants
ORG000365;eBay;United States;E-commerce;Retail;Sustainable resale platforms, Blockchain for supply chain transparency, Automated checkout experiences;AI-powered in-store assistants, Automated checkout experiences, Sustainable resale platforms
ORG000366;JD.com;China;E-commerce;Retail;Sustainable resale platforms, Automated checkout experiences, Subscription-based retail models;Blockchain for supply chain transparency, AI-powered in-store assistants, Sustainable resale platforms
ORG000367;Carrefour;France;Supermarkets;Retail;AI-powered in-store assistants, Blockchain for supply chain transparency, Dynamic pricing optimization;Blockchain for supply chain transparency, Dynamic pricing optimization, AI-powered in-store assistants
ORG000368;Kroger;United States;Supermarkets;Retail;AI-powered in-store assistants, Dynamic pricing optimization, Blockchain for supply chain transparency;Automated checkout experiences, Subscription-based retail models, Dynamic pricing optimization
ORG000369;Tesco;United Kingdom;Supermarkets;Retail;AI-powered in-store assistants, Sustainable resale platforms, Blockchain for supply chain transparency;Automated checkout experiences, Blockchain for supply chain transparency, Sustainable resale platforms
ORG000370;Walmart;United States;Supermarkets;Retail;Automated checkout experiences, Subscription-based retail models, Blockchain for supply chain transparency;Dynamic pricing optimization, Sustainable resale platforms, AI-powered in-store assistants
ORG000371;Chanel;France;Luxury Retail;Retail;Automated checkout experiences, Dynamic pricing optimization, Subscription-based retail models;Dynamic pricing optimization, Automated checkout experiences, Blockchain for supply chain transparency
ORG000372;Gucci;Italy;Luxury Retail;Retail;Subscription-based retail models, Blockchain for supply chain transparency, Dynamic pricing optimization;Dynamic pricing optimization, Subscription-based retail models, Blockchain for supply chain transparency
ORG000373;LVMH;France;Luxury Retail;Retail;Subscription-based retail models, AI-powered in-store assistants, Sustainable resale platforms;Sustainable resale platforms, Dynamic pricing optimization, Automated checkout experiences
ORG000374;Prada;Italy;Luxury Retail;Retail;Sustainable resale platforms, Blockchain for supply chain transparency, AI-powered in-store assistants;Automated checkout experiences, Sustainable resale platforms, AI-powered in-store assistants
ORG000375;Harrods;United Kingdom;Department Stores;Retail;Sustainable resale platforms, Automated checkout experiences, AI-powered in-store assistants;Subscription-based retail models, AI-powered in-store assistants, Automated checkout experiences
ORG000376;Macy's;United States;Department Stores;Retail;Subscription-based retail models, Automated checkout experiences, Dynamic pricing optimization;Blockchain for supply chain transparency, Automated checkout experiences, Sustainable resale platforms
ORG000377;Nordstrom;United States;Department Stores;Retail;Sustainable resale platforms, AI-powered in-store assistants, Blockchain for supply chain transparency;Sustainable resale platforms, Automated checkout experiences, Blockchain for supply chain transparency
ORG000378;Saks Fifth Avenue;United States;Department Stores;Retail;Dynamic pricing optimization, AI-powered in-store assistants, Automated checkout experiences;Automated checkout experiences, Dynamic pricing optimization, AI-powered in-store assistants
ORG000379;Verizon Communications;United States;Mobile Networks;Telecommunications;Global low-cost internet access, Holographic telepresence tech, Smart contract-enabled billing;Global low-cost internet access, Holographic telepresence tech, Decentralized web infrastructure
ORG000380;AT&T Inc.;United States;Mobile Networks;Telecommunications;Holographic telepresence tech, AI-enhanced network optimization, Quantum-secure communications;Quantum-secure communications, Holographic telepresence tech, Smart contract-enabled billing
ORG000381;Vodafone Group;United Kingdom;Mobile Networks;Telecommunications;Quantum-secure communications, Decentralized web infrastructure, Global low-cost internet access;Decentralized web infrastructure, Quantum-secure communications, Smart contract-enabled billing
ORG000382;China Mobile;China;Mobile Networks;Telecommunications;Global low-cost internet access, AI-enhanced network optimization, Quantum-secure communications;Quantum-secure communications, Decentralized web infrastructure, Global low-cost internet access
ORG000383;Comcast Corporation;United States;Broadband Providers;Telecommunications;Smart contract-enabled billing, AI-enhanced network optimization, Quantum-secure communications;Global low-cost internet access, Decentralized web infrastructure, Smart contract-enabled billing
ORG000384;Charter Communications;United States;Broadband Providers;Telecommunications;AI-enhanced network optimization, Global low-cost internet access, Smart contract-enabled billing;Smart contract-enabled billing, Decentralized web infrastructure, AI-enhanced network optimization
ORG000385;Nippon Telegraph and Telephone Corporation (NTT);Japan;Broadband Providers;Telecommunications;Smart contract-enabled billing, Holographic telepresence tech, Global low-cost internet access;Smart contract-enabled billing, Holographic telepresence tech, Global low-cost internet access
ORG000386;BT Group;United Kingdom;Broadband Providers;Telecommunications;Holographic telepresence tech, Smart contract-enabled billing, AI-enhanced network optimization;Holographic telepresence tech, AI-enhanced network optimization, Quantum-secure communications
ORG000387;Huawei Technologies Co., Ltd.;China;5G Infrastructure;Telecommunications;Global low-cost internet access, Holographic telepresence tech, Decentralized web infrastructure;Holographic telepresence tech, AI-enhanced network optimization, Smart contract-enabled billing
ORG000388;Ericsson;Sweden;5G Infrastructure;Telecommunications;Decentralized web infrastructure, Global low-cost internet access, Quantum-secure communications;Global low-cost internet access, Smart contract-enabled billing, Decentralized web infrastructure
ORG000389;Nokia Corporation;Finland;5G Infrastructure;Telecommunications;Holographic telepresence tech, AI-enhanced network optimization, Decentralized web infrastructure;Smart contract-enabled billing, Global low-cost internet access, Holographic telepresence tech
ORG000390;Qualcomm Incorporated;United States;5G Infrastructure;Telecommunications;Holographic telepresence tech, Smart contract-enabled billing, AI-enhanced network optimization;Holographic telepresence tech, Quantum-secure communications, Global low-cost internet access
ORG000391;SpaceX (Starlink);United States;Satellite Internet;Telecommunications;Holographic telepresence tech, Smart contract-enabled billing, Global low-cost internet access;Holographic telepresence tech, Smart contract-enabled billing, Decentralized web infrastructure
ORG000392;OneWeb;United Kingdom;Satellite Internet;Telecommunications;Decentralized web infrastructure, Holographic telepresence tech, Quantum-secure communications;AI-enhanced network optimization, Global low-cost internet access, Smart contract-enabled billing
ORG000393;Viasat Inc.;United States;Satellite Internet;Telecommunications;Global low-cost internet access, AI-enhanced network optimization, Decentralized web infrastructure;Smart contract-enabled billing, Global low-cost internet access, Decentralized web infrastructure
ORG000394;Amazon (Project Kuiper);United States;Satellite Internet;Telecommunications;Holographic telepresence tech, AI-enhanced network optimization, Global low-cost internet access;Decentralized web infrastructure, AI-enhanced network optimization, Global low-cost internet access
ORG000395;Duke Energy;United States;Electric Utilities;Utilities;AI-driven water conservation, Energy-sharing peer networks, Smart waste processing tech;Carbon-negative power plants, Energy-sharing peer networks, Self-repairing infrastructure
ORG000396;EDF (Électricité de France);France;Electric Utilities;Utilities;AI-driven water conservation, Smart waste processing tech, Carbon-negative power plants;Smart waste processing tech, Carbon-negative power plants, Decentralized energy grids
ORG000397;Enel;Italy;Electric Utilities;Utilities;AI-driven water conservation, Smart waste processing tech, Decentralized energy grids;Energy-sharing peer networks, Self-repairing infrastructure, AI-driven water conservation
ORG000398;NextEra Energy;United States;Electric Utilities;Utilities;Energy-sharing peer networks, Carbon-negative power plants, Self-repairing infrastructure;Carbon-negative power plants, Decentralized energy grids, Self-repairing infrastructure
ORG000399;China National Petroleum Corporation (CNPC);China;Natural Gas Utilities;Utilities;Decentralized energy grids, Self-repairing infrastructure, Carbon-negative power plants;Carbon-negative power plants, Smart waste processing tech, Energy-sharing peer networks
ORG000400;Gazprom;Russia;Natural Gas Utilities;Utilities;Energy-sharing peer networks, AI-driven water conservation, Smart waste processing tech;AI-driven water conservation, Smart waste processing tech, Energy-sharing peer networks
ORG000401;Sempra Energy;United States;Natural Gas Utilities;Utilities;Decentralized energy grids, Self-repairing infrastructure, Carbon-negative power plants;Energy-sharing peer networks, Decentralized energy grids, Carbon-negative power plants
ORG000402;TC Energy;Canada;Natural Gas Utilities;Utilities;AI-driven water conservation, Carbon-negative power plants, Energy-sharing peer networks;Carbon-negative power plants, Decentralized energy grids, Smart waste processing tech
ORG000403;American Water Works;United States;Water Utilities;Utilities;Decentralized energy grids, AI-driven water conservation, Energy-sharing peer networks;Self-repairing infrastructure, Smart waste processing tech, Energy-sharing peer networks
ORG000404;Severn Trent;United Kingdom;Water Utilities;Utilities;AI-driven water conservation, Carbon-negative power plants, Smart waste processing tech;Smart waste processing tech, Self-repairing infrastructure, Energy-sharing peer networks
ORG000405;Suez;France;Water Utilities;Utilities;Energy-sharing peer networks, Carbon-negative power plants, AI-driven water conservation;Self-repairing infrastructure, Decentralized energy grids, AI-driven water conservation
ORG000406;Veolia;France;Water Utilities;Utilities;Energy-sharing peer networks, Self-repairing infrastructure, AI-driven water conservation;Carbon-negative power plants, Self-repairing infrastructure, Decentralized energy grids
ORG000407;Republic Services;United States;Waste Management;Utilities;Decentralized energy grids, Smart waste processing tech, AI-driven water conservation;Decentralized energy grids, Energy-sharing peer networks, AI-driven water conservation
ORG000408;SUEZ Recycling & Recovery;France;Waste Management;Utilities;Smart waste processing tech, Decentralized energy grids, AI-driven water conservation;Carbon-negative power plants, AI-driven water conservation, Decentralized energy grids
ORG000409;Veolia Environmental Services;France;Waste Management;Utilities;Energy-sharing peer networks, AI-driven water conservation, Self-repairing infrastructure;Carbon-negative power plants, Decentralized energy grids, Self-repairing infrastructure
ORG000410;Waste Management, Inc.;United States;Waste Management;Utilities;AI-driven water conservation, Carbon-negative power plants, Energy-sharing peer networks;Energy-sharing peer networks, Decentralized energy grids, Smart waste processing tech
