CID;NAME;COUNTRY;INDUSTRY;SECTOR;REQUIREMENTS;PREFERENCES
ORG000011;Airbus;France;Aircraft Manufacturing;Aerospace & Defense;Defense offset agreements, Stable government funding, Private sector partnerships;Private sector partnerships, Defense offset agreements, Advanced aerospace R&D
ORG000012;Boeing;United States;Aircraft Manufacturing;Aerospace & Defense;Export-friendly tax policies, Advanced aerospace R&D, Defense offset agreements;Export-friendly tax policies, Long-term procurement cycles, Private sector partnerships
ORG000013;Bombardier Aerospace;Canada;Aircraft Manufacturing;Aerospace & Defense;Advanced aerospace R&D, Export-friendly tax policies, Long-term procurement cycles;Defense offset agreements, Advanced aerospace R&D, Private sector partnerships
ORG000014;Embraer;Brazil;Aircraft Manufacturing;Aerospace & Defense;Export-friendly tax policies, Stable government funding, Advanced aerospace R&D;Advanced aerospace R&D, Export-friendly tax policies, Private sector partnerships
ORG000015;BAE Systems;United Kingdom;Defense Contractors;Aerospace & Defense;Stable government funding, Defense offset agreements, Export-friendly tax policies;Stable government funding, Advanced aerospace R&D, Long-term procurement cycles
ORG000016;General Dynamics;United States;Defense Contractors;Aerospace & Defense;Private sector partnerships, Advanced aerospace R&D, Export-friendly tax policies;Private sector partnerships, Stable government funding, Advanced aerospace R&D
ORG000017;Lockheed Martin;United States;Defense Contractors;Aerospace & Defense;Advanced aerospace R&D, Private sector partnerships, Stable government funding;Advanced aerospace R&D, Stable government funding, Defense offset agreements
ORG000018;Northrop Grumman;United States;Defense Contractors;Aerospace & Defense;Private sector partnerships, Advanced aerospace R&D, Long-term procurement cycles;Defense offset agreements, Long-term procurement cycles, Stable government funding
ORG000019;Leonardo S.p.A.;Italy;Military Systems;Aerospace & Defense;Private sector partnerships, Defense offset agreements, Export-friendly tax policies;Private sector partnerships, Long-term procurement cycles, Export-friendly tax policies
ORG000020;Raytheon Technologies;United States;Military Systems;Aerospace & Defense;Stable government funding, Defense offset agreements, Advanced aerospace R&D;Advanced aerospace R&D, Private sector partnerships, Long-term procurement cycles
ORG000021;Saab AB;Sweden;Military Systems;Aerospace & Defense;Private sector partnerships, Stable government funding, Defense offset agreements;Private sector partnerships, Long-term procurement cycles, Export-friendly tax policies
ORG000022;Thales Group;France;Military Systems;Aerospace & Defense;Advanced aerospace R&D, Private sector partnerships, Export-friendly tax policies;Long-term procurement cycles, Defense offset agreements, Advanced aerospace R&D
ORG000023;Blue Origin;United States;Space Exploration;Aerospace & Defense;Private sector partnerships, Long-term procurement cycles, Export-friendly tax policies;Export-friendly tax policies, Stable government funding, Advanced aerospace R&D
ORG000024;Northrop Grumman;United States;Space Exploration;Aerospace & Defense;Long-term procurement cycles, Export-friendly tax policies, Defense offset agreements;Long-term procurement cycles, Defense offset agreements, Stable government funding
ORG000025;SpaceX;United States;Space Exploration;Aerospace & Defense;Advanced aerospace R&D, Stable government funding, Private sector partnerships;Defense offset agreements, Export-friendly tax policies, Long-term procurement cycles
ORG000026;United Launch Alliance;United States;Space Exploration;Aerospace & Defense;Defense offset agreements, Long-term procurement cycles, Stable government funding;Stable government funding, Long-term procurement cycles, Private sector partnerships
ORG000027;ADM (Archer Daniels Midland);United States;Agribusiness;Agriculture;Efficient water usage funds, Organic farming incentives, Agri-fintech adoption;Farmer co-op funding, Efficient water usage funds, Climate-smart farming models
ORG000028;Bunge Limited;United States;Agribusiness;Agriculture;Farmer co-op funding, Climate-smart farming models, Efficient water usage funds;Efficient water usage funds, Farmer co-op funding, Agri-fintech adoption
ORG000029;Cargill;United States;Agribusiness;Agriculture;Agri-fintech adoption, Climate-smart farming models, Organic farming incentives;Farmer co-op funding, Organic farming incentives, Climate-smart farming models
ORG000030;Nutrien Ag Solutions;Canada;Agribusiness;Agriculture;Agri-fintech adoption, Efficient water usage funds, Farmer co-op funding;High-yield seed research, Efficient water usage funds, Agri-fintech adoption
ORG000031;Ag Leader Technology;United States;Precision Agriculture;Agriculture;Efficient water usage funds, Agri-fintech adoption, Farmer co-op funding;Farmer co-op funding, Efficient water usage funds, Organic farming incentives
ORG000032;AgJunction, Inc.;Canada;Precision Agriculture;Agriculture;Agri-fintech adoption, Farmer co-op funding, High-yield seed research;High-yield seed research, Agri-fintech adoption, Organic farming incentives
ORG000033;Deere & Company;United States;Precision Agriculture;Agriculture;Organic farming incentives, Farmer co-op funding, Climate-smart farming models;High-yield seed research, Climate-smart farming models, Efficient water usage funds
ORG000034;Trimble Inc.;United States;Precision Agriculture;Agriculture;High-yield seed research, Organic farming incentives, Agri-fintech adoption;Farmer co-op funding, High-yield seed research, Climate-smart farming models
ORG000035;BASF SE;Germany;Agrochemicals;Agriculture;Organic farming incentives, High-yield seed research, Efficient water usage funds;Farmer co-op funding, Organic farming incentives, High-yield seed research
ORG000036;Bayer CropScience;Germany;Agrochemicals;Agriculture;Organic farming incentives, Agri-fintech adoption, Climate-smart farming models;Organic farming incentives, Climate-smart farming models, Efficient water usage funds
ORG000037;Corteva Agriscience;United States;Agrochemicals;Agriculture;Organic farming incentives, Climate-smart farming models, Farmer co-op funding;Efficient water usage funds, Organic farming incentives, Climate-smart farming models
ORG000038;Syngenta AG;Switzerland;Agrochemicals;Agriculture;High-yield seed research, Climate-smart farming models, Efficient water usage funds;High-yield seed research, Organic farming incentives, Efficient water usage funds
ORG000039;Bayer CropScience;Germany;Seed & Fertilizer;Agriculture;Farmer co-op funding, High-yield seed research, Agri-fintech adoption;Agri-fintech adoption, Organic farming incentives, Efficient water usage funds
ORG000040;Corteva Agriscience;United States;Seed & Fertilizer;Agriculture;Climate-smart farming models, High-yield seed research, Farmer co-op funding;Agri-fintech adoption, High-yield seed research, Climate-smart farming models
ORG000041;Nutrien Ltd.;Canada;Seed & Fertilizer;Agriculture;Agri-fintech adoption, Farmer co-op funding, Efficient water usage funds;Organic farming incentives, Climate-smart farming models, Farmer co-op funding
ORG000042;Syngenta AG;Switzerland;Seed & Fertilizer;Agriculture;Efficient water usage funds, Climate-smart farming models, High-yield seed research;Organic farming incentives, High-yield seed research, Agri-fintech adoption
ORG000043;BYD Auto;China;Automakers;Automotive;Mass transit electrification, Flexible EV charging options, Lightweight material R&D;Self-driving regulations, Flexible EV charging options, Lightweight material R&D
ORG000044;Ford Motor Company;United States;Automakers;Automotive;Battery swapping networks, Flexible EV charging options, Mass transit electrification;Battery swapping networks, Flexible EV charging options, AI-based vehicle safety funds
ORG000045;Tesla, Inc.;United States;Automakers;Automotive;Battery swapping networks, AI-based vehicle safety funds, Lightweight material R&D;Lightweight material R&D, Mass transit electrification, Flexible EV charging options
ORG000046;Volkswagen Group;Germany;Automakers;Automotive;Self-driving regulations, Flexible EV charging options, Mass transit electrification;Flexible EV charging options, Lightweight material R&D, Self-driving regulations
ORG000047;BYD Auto;China;Electric Vehicles;Automotive;Battery swapping networks, Self-driving regulations, AI-based vehicle safety funds;Lightweight material R&D, Flexible EV charging options, Battery swapping networks
ORG000048;Hyundai Motor Company;South Korea;Electric Vehicles;Automotive;Battery swapping networks, Lightweight material R&D, AI-based vehicle safety funds;Self-driving regulations, Lightweight material R&D, Battery swapping networks
ORG000049;Tesla, Inc.;United States;Electric Vehicles;Automotive;Lightweight material R&D, Mass transit electrification, Battery swapping networks;Battery swapping networks, Lightweight material R&D, Self-driving regulations
ORG000050;Volkswagen Group;Germany;Electric Vehicles;Automotive;AI-based vehicle safety funds, Battery swapping networks, Lightweight material R&D;Flexible EV charging options, AI-based vehicle safety funds, Battery swapping networks
ORG000051;Bosch;Germany;Auto Parts & Suppliers;Automotive;Mass transit electrification, Battery swapping networks, Lightweight material R&D;Battery swapping networks, AI-based vehicle safety funds, Flexible EV charging options
ORG000052;Continental AG;Germany;Auto Parts & Suppliers;Automotive;Mass transit electrification, Flexible EV charging options, Battery swapping networks;Lightweight material R&D, AI-based vehicle safety funds, Self-driving regulations
ORG000053;DENSO Corporation;Japan;Auto Parts & Suppliers;Automotive;AI-based vehicle safety funds, Mass transit electrification, Flexible EV charging options;AI-based vehicle safety funds, Battery swapping networks, Flexible EV charging options
ORG000054;Magna International;Canada;Auto Parts & Suppliers;Automotive;Battery swapping networks, Mass transit electrification, Lightweight material R&D;Mass transit electrification, Flexible EV charging options, Self-driving regulations
ORG000055;Didi Chuxing;China;Mobility Services;Automotive;Self-driving regulations, Battery swapping networks, Flexible EV charging options;Flexible EV charging options, Mass transit electrification, Self-driving regulations
ORG000056;Lyft, Inc.;United States;Mobility Services;Automotive;Mass transit electrification, Battery swapping networks, Flexible EV charging options;Battery swapping networks, AI-based vehicle safety funds, Mass transit electrification
ORG000057;Uber Technologies, Inc.;United States;Mobility Services;Automotive;Lightweight material R&D, AI-based vehicle safety funds, Battery swapping networks;Mass transit electrification, AI-based vehicle safety funds, Battery swapping networks
ORG000058;Waymo LLC;United States;Mobility Services;Automotive;Lightweight material R&D, Self-driving regulations, Mass transit electrification;Flexible EV charging options, Battery swapping networks, AI-based vehicle safety funds
ORG000059;Amgen Inc.;United States;Biopharmaceuticals;Biotechnology;Global disease prevention funds, Bioinformatics expansion, Biotech patent fast-tracking;Biotech patent fast-tracking, AI-powered drug testing, Regenerative medicine support
ORG000060;Biogen Inc.;United States;Biopharmaceuticals;Biotechnology;Bioinformatics expansion, Biotech patent fast-tracking, AI-powered drug testing;Biotech patent fast-tracking, Global disease prevention funds, Regenerative medicine support
ORG000061;Gilead Sciences;United States;Biopharmaceuticals;Biotechnology;Regenerative medicine support, Biotech patent fast-tracking, Global disease prevention funds;Biotech patent fast-tracking, Bioinformatics expansion, Regenerative medicine support
ORG000062;Novo Nordisk A/S;Denmark;Biopharmaceuticals;Biotechnology;Affordable gene therapies, Global disease prevention funds, Biotech patent fast-tracking;Global disease prevention funds, Bioinformatics expansion, AI-powered drug testing
ORG000063;23andMe Holding Co.;United States;Genomics;Biotechnology;Global disease prevention funds, Regenerative medicine support, Affordable gene therapies;Bioinformatics expansion, Global disease prevention funds, Biotech patent fast-tracking
ORG000064;Illumina, Inc.;United States;Genomics;Biotechnology;Biotech patent fast-tracking, Global disease prevention funds, Bioinformatics expansion;Biotech patent fast-tracking, Global disease prevention funds, Regenerative medicine support
ORG000065;Oxford Nanopore Technologies;United Kingdom;Genomics;Biotechnology;AI-powered drug testing, Regenerative medicine support, Bioinformatics expansion;Biotech patent fast-tracking, Bioinformatics expansion, Global disease prevention funds
ORG000066;Pacific Biosciences of California, Inc.;United States;Genomics;Biotechnology;Affordable gene therapies, Bioinformatics expansion, Global disease prevention funds;Global disease prevention funds, Affordable gene therapies, Regenerative medicine support
ORG000067;CRISPR Therapeutics AG;Switzerland;Medical Biotech;Biotechnology;Regenerative medicine support, Biotech patent fast-tracking, Affordable gene therapies;Affordable gene therapies, Regenerative medicine support, Bioinformatics expansion
ORG000068;Moderna, Inc.;United States;Medical Biotech;Biotechnology;Biotech patent fast-tracking, AI-powered drug testing, Regenerative medicine support;AI-powered drug testing, Regenerative medicine support, Affordable gene therapies
ORG000069;Regeneron Pharmaceuticals, Inc.;United States;Medical Biotech;Biotechnology;Affordable gene therapies, Bioinformatics expansion, Global disease prevention funds;Affordable gene therapies, Biotech patent fast-tracking, AI-powered drug testing
ORG000070;Vertex Pharmaceuticals Incorporated;United States;Medical Biotech;Biotechnology;Bioinformatics expansion, Biotech patent fast-tracking, Regenerative medicine support;Biotech patent fast-tracking, Affordable gene therapies, Bioinformatics expansion
ORG000071;Ginkgo Bioworks Holdings, Inc.;United States;Synthetic Biology;Biotechnology;Global disease prevention funds, Affordable gene therapies, Biotech patent fast-tracking;Global disease prevention funds, Bioinformatics expansion, Biotech patent fast-tracking
ORG000072;Inscripta, Inc.;United States;Synthetic Biology;Biotechnology;Global disease prevention funds, AI-powered drug testing, Affordable gene therapies;Global disease prevention funds, Regenerative medicine support, Biotech patent fast-tracking
ORG000073;Synthego Corporation;United States;Synthetic Biology;Biotechnology;Biotech patent fast-tracking, Affordable gene therapies, AI-powered drug testing;Global disease prevention funds, Bioinformatics expansion, Biotech patent fast-tracking
ORG000074;Zymergen Inc.;United States;Synthetic Biology;Biotechnology;AI-powered drug testing, Biotech patent fast-tracking, Regenerative medicine support;Bioinformatics expansion, Global disease prevention funds, Regenerative medicine support
ORG000075;BASF SE;Germany;Agrochemicals;Chemicals;Plastic waste reduction, Bio-based chemical subsidies, Non-toxic alternatives R&D;Bio-based chemical subsidies, Non-toxic alternatives R&D, Water purification tech investment
ORG000076;BASF SE;Germany;Industrial Chemicals;Chemicals;Air pollution control funds, Bio-based chemical subsidies, Water purification tech investment;Energy-efficient production, Air pollution control funds, Bio-based chemical subsidies
ORG000077;BASF SE;Germany;Petrochemicals;Chemicals;Air pollution control funds, Water purification tech investment, Bio-based chemical subsidies;Plastic waste reduction, Non-toxic alternatives R&D, Energy-efficient production
ORG000078;BASF SE;Germany;Specialty Chemicals;Chemicals;Water purification tech investment, Non-toxic alternatives R&D, Plastic waste reduction;Plastic waste reduction, Water purification tech investment, Energy-efficient production
ORG000079;Dow Inc.;United States;Industrial Chemicals;Chemicals;Plastic waste reduction, Air pollution control funds, Bio-based chemical subsidies;Plastic waste reduction, Bio-based chemical subsidies, Water purification tech investment
ORG000080;Dow Inc.;United States;Petrochemicals;Chemicals;Water purification tech investment, Non-toxic alternatives R&D, Plastic waste reduction;Bio-based chemical subsidies, Energy-efficient production, Water purification tech investment
ORG000081;Dow Inc.;United States;Specialty Chemicals;Chemicals;Energy-efficient production, Water purification tech investment, Bio-based chemical subsidies;Plastic waste reduction, Energy-efficient production, Non-toxic alternatives R&D
ORG000082;INEOS Group;United Kingdom;Industrial Chemicals;Chemicals;Bio-based chemical subsidies, Non-toxic alternatives R&D, Plastic waste reduction;Air pollution control funds, Bio-based chemical subsidies, Energy-efficient production
ORG000083;INEOS Group;United Kingdom;Petrochemicals;Chemicals;Water purification tech investment, Bio-based chemical subsidies, Non-toxic alternatives R&D;Energy-efficient production, Plastic waste reduction, Non-toxic alternatives R&D
ORG000084;INEOS Group;United Kingdom;Specialty Chemicals;Chemicals;Air pollution control funds, Energy-efficient production, Plastic waste reduction;Bio-based chemical subsidies, Energy-efficient production, Air pollution control funds
ORG000085;LG Chem;South Korea;Industrial Chemicals;Chemicals;Bio-based chemical subsidies, Non-toxic alternatives R&D, Air pollution control funds;Bio-based chemical subsidies, Water purification tech investment, Non-toxic alternatives R&D
ORG000086;LG Chem;South Korea;Petrochemicals;Chemicals;Air pollution control funds, Non-toxic alternatives R&D, Energy-efficient production;Plastic waste reduction, Non-toxic alternatives R&D, Bio-based chemical subsidies
ORG000087;LG Chem;South Korea;Specialty Chemicals;Chemicals;Energy-efficient production, Plastic waste reduction, Bio-based chemical subsidies;Energy-efficient production, Bio-based chemical subsidies, Water purification tech investment
ORG000088;SABIC;Saudi Arabia;Industrial Chemicals;Chemicals;Plastic waste reduction, Air pollution control funds, Energy-efficient production;Plastic waste reduction, Energy-efficient production, Air pollution control funds
ORG000089;SABIC;Saudi Arabia;Petrochemicals;Chemicals;Energy-efficient production, Plastic waste reduction, Bio-based chemical subsidies;Bio-based chemical subsidies, Air pollution control funds, Non-toxic alternatives R&D
ORG000090;SABIC;Saudi Arabia;Specialty Chemicals;Chemicals;Non-toxic alternatives R&D, Air pollution control funds, Energy-efficient production;Air pollution control funds, Energy-efficient production, Non-toxic alternatives R&D
ORG000091;Bechtel Corporation;United States;Civil Engineering;Construction;3D-printed building projects, Seismic-resistant designs, Energy-neutral housing;Zero-waste construction goals, Seismic-resistant designs, 3D-printed building projects
ORG000092;Bechtel Corporation;United States;Commercial Construction;Construction;Zero-waste construction goals, Energy-neutral housing, AI-based construction planning;AI-based construction planning, Seismic-resistant designs, 3D-printed building projects
ORG000093;Bechtel Corporation;United States;Infrastructure Projects;Construction;3D-printed building projects, Zero-waste construction goals, Smart city development;Smart city development, Seismic-resistant designs, AI-based construction planning
ORG000094;Bechtel Corporation;United States;Residential Construction;Construction;3D-printed building projects, Smart city development, AI-based construction planning;Energy-neutral housing, Smart city development, AI-based construction planning
ORG000095;Grupo ACS;Spain;Civil Engineering;Construction;Energy-neutral housing, 3D-printed building projects, AI-based construction planning;3D-printed building projects, AI-based construction planning, Smart city development
ORG000096;Grupo ACS;Spain;Commercial Construction;Construction;Seismic-resistant designs, Zero-waste construction goals, Energy-neutral housing;AI-based construction planning, Energy-neutral housing, Seismic-resistant designs
ORG000097;Grupo ACS;Spain;Infrastructure Projects;Construction;Smart city development, 3D-printed building projects, Seismic-resistant designs;AI-based construction planning, Energy-neutral housing, Smart city development
ORG000098;Grupo ACS;Spain;Residential Construction;Construction;Seismic-resistant designs, Zero-waste construction goals, AI-based construction planning;Seismic-resistant designs, Smart city development, AI-based construction planning
ORG000099;VINCI;France;Civil Engineering;Construction;Seismic-resistant designs, Smart city development, Energy-neutral housing;Zero-waste construction goals, Seismic-resistant designs, Energy-neutral housing
ORG000100;VINCI;France;Commercial Construction;Construction;AI-based construction planning, Smart city development, Seismic-resistant designs;Smart city development, Zero-waste construction goals, Seismic-resistant designs
ORG000101;VINCI;France;Infrastructure Projects;Construction;3D-printed building projects, Zero-waste construction goals, Energy-neutral housing;3D-printed building projects, Zero-waste construction goals, Seismic-resistant designs
ORG000102;VINCI;France;Residential Construction;Construction;Smart city development, Energy-neutral housing, Zero-waste construction goals;Energy-neutral housing, 3D-printed building projects, Zero-waste construction goals
ORG000103;Skanska;Sweden;Civil Engineering;Construction;Seismic-resistant designs, Zero-waste construction goals, AI-based construction planning;AI-based construction planning, Energy-neutral housing, 3D-printed building projects
ORG000104;Skanska;Sweden;Commercial Construction;Construction;AI-based construction planning, Energy-neutral housing, 3D-printed building projects;3D-printed building projects, AI-based construction planning, Seismic-resistant designs
ORG000105;Skanska;Sweden;Infrastructure Projects;Construction;Energy-neutral housing, 3D-printed building projects, Smart city development;Zero-waste construction goals, Seismic-resistant designs, Smart city development
ORG000106;Skanska;Sweden;Residential Construction;Construction;Zero-waste construction goals, Seismic-resistant designs, Energy-neutral housing;3D-printed building projects, AI-based construction planning, Zero-waste construction goals
ORG000107;Chanel;France;Luxury Goods;Consumer Goods;Custom manufacturing scaling, Zero-waste retail programs, Minimalist packaging initiatives;Ethical consumerism trends, AI-driven product recommendations, Minimalist packaging initiatives
ORG000108;Estée Lauder Companies;United States;Personal Care Products;Consumer Goods;AI-driven product recommendations, Custom manufacturing scaling, Zero-waste retail programs;AI-driven product recommendations, Zero-waste retail programs, Ethical consumerism trends
ORG000109;Hermès International;France;Luxury Goods;Consumer Goods;Zero-waste retail programs, Ethical consumerism trends, Minimalist packaging initiatives;Minimalist packaging initiatives, AI-driven product recommendations, Zero-waste retail programs
ORG000110;L'Oréal;France;Personal Care Products;Consumer Goods;Biodegradable material R&D, Zero-waste retail programs, AI-driven product recommendations;Ethical consumerism trends, Custom manufacturing scaling, Biodegradable material R&D
ORG000111;LVMH Moët Hennessy Louis Vuitton;France;Luxury Goods;Consumer Goods;Minimalist packaging initiatives, Custom manufacturing scaling, Zero-waste retail programs;Ethical consumerism trends, Minimalist packaging initiatives, Custom manufacturing scaling
ORG000112;Nestlé;Switzerland;Packaged Goods;Consumer Goods;Ethical consumerism trends, Custom manufacturing scaling, Biodegradable material R&D;Ethical consumerism trends, Custom manufacturing scaling, Zero-waste retail programs
ORG000113;Nike, Inc.;United States;Apparel & Footwear;Consumer Goods;Minimalist packaging initiatives, Ethical consumerism trends, AI-driven product recommendations;Biodegradable material R&D, Minimalist packaging initiatives, Custom manufacturing scaling
ORG000114;Procter & Gamble;United States;Personal Care Products;Consumer Goods;AI-driven product recommendations, Minimalist packaging initiatives, Custom manufacturing scaling;Ethical consumerism trends, Biodegradable material R&D, Zero-waste retail programs
ORG000115;Ralph Lauren Corporation;United States;Apparel & Footwear;Consumer Goods;AI-driven product recommendations, Minimalist packaging initiatives, Zero-waste retail programs;Ethical consumerism trends, Minimalist packaging initiatives, AI-driven product recommendations
ORG000116;Reckitt Benckiser Group;United Kingdom;Packaged Goods;Consumer Goods;Ethical consumerism trends, Biodegradable material R&D, Zero-waste retail programs;Zero-waste retail programs, Ethical consumerism trends, Biodegradable material R&D
ORG000117;Richemont;Switzerland;Luxury Goods;Consumer Goods;Ethical consumerism trends, AI-driven product recommendations, Zero-waste retail programs;AI-driven product recommendations, Custom manufacturing scaling, Minimalist packaging initiatives
ORG000118;The Coca-Cola Company;United States;Packaged Goods;Consumer Goods;AI-driven product recommendations, Zero-waste retail programs, Minimalist packaging initiatives;Custom manufacturing scaling, Zero-waste retail programs, Ethical consumerism trends
ORG000119;The Kraft Heinz Company;United States;Packaged Goods;Consumer Goods;AI-driven product recommendations, Ethical consumerism trends, Zero-waste retail programs;Custom manufacturing scaling, Minimalist packaging initiatives, Biodegradable material R&D
