CID;NAME;COUNTRY;INDUSTRY;SECTOR;REQUIREMENTS;PREFERENCES
ORG000229;Norwegian Cruise Line;United States;Cruise Lines;Hospitality;AI concierge services, Luxury eco-lodges funding, Wellness tourism incentives;Blockchain-based booking security, Wellness tourism incentives, Luxury eco-lodges funding
ORG000230;Royal Caribbean International;United States;Cruise Lines;Hospitality;Seamless travel experiences, Luxury eco-lodges funding, AI concierge services;Wellness tourism incentives, Zero-waste event planning, Blockchain-based booking security
ORG000231;Booking Holdings;United States;Travel Agencies;Hospitality;Seamless travel experiences, Wellness tourism incentives, AI concierge services;Seamless travel experiences, Wellness tourism incentives, Zero-waste event planning
ORG000232;Expedia Group;United States;Travel Agencies;Hospitality;AI concierge services, Seamless travel experiences, Zero-waste event planning;Seamless travel experiences, Zero-waste event planning, Blockchain-based booking security
ORG000233;Trip.com Group;China;Travel Agencies;Hospitality;Blockchain-based booking security, AI concierge services, Luxury eco-lodges funding;Luxury eco-lodges funding, Blockchain-based booking security, Seamless travel experiences
ORG000234;TUI Group;Germany;Travel Agencies;Hospitality;AI concierge services, Luxury eco-lodges funding, Blockchain-based booking security;AI concierge services, Wellness tourism incentives, Luxury eco-lodges funding
ORG000235;Amazon Web Services (AWS);United States;Cloud Computing;Information Technology;Next-gen cybersecurity models, Ethical AI funding, Decentralized data ownership;Augmented workforce systems, Next-gen cybersecurity models, AI-powered automation tools
ORG000236;Google Cloud;United States;Cloud Computing;Information Technology;Next-gen cybersecurity models, Augmented workforce systems, AI-powered automation tools;Ethical AI funding, Augmented workforce systems, Decentralized data ownership
ORG000237;IBM Cloud;United States;Cloud Computing;Information Technology;Decentralized data ownership, Augmented workforce systems, Ethical AI funding;Augmented workforce systems, Next-gen cybersecurity models, Ethical AI funding
ORG000238;Microsoft Azure;United States;Cloud Computing;Information Technology;Quantum networking research, AI-powered automation tools, Augmented workforce systems;Decentralized data ownership, Next-gen cybersecurity models, Augmented workforce systems
ORG000239;CrowdStrike;United States;Cybersecurity;Information Technology;Quantum networking research, AI-powered automation tools, Next-gen cybersecurity models;Ethical AI funding, Decentralized data ownership, Augmented workforce systems
ORG000240;Darktrace;United Kingdom;Cybersecurity;Information Technology;AI-powered automation tools, Next-gen cybersecurity models, Decentralized data ownership;AI-powered automation tools, Decentralized data ownership, Quantum networking research
ORG000241;Palo Alto Networks;United States;Cybersecurity;Information Technology;Ethical AI funding, Next-gen cybersecurity models, Augmented workforce systems;AI-powered automation tools, Augmented workforce systems, Next-gen cybersecurity models
ORG000242;Symantec Corporation;United States;Cybersecurity;Information Technology;Ethical AI funding, AI-powered automation tools, Decentralized data ownership;AI-powered automation tools, Ethical AI funding, Next-gen cybersecurity models
ORG000243;Alphabet Inc.;United States;Artificial Intelligence;Information Technology;Quantum networking research, Augmented workforce systems, AI-powered automation tools;Decentralized data ownership, AI-powered automation tools, Augmented workforce systems
ORG000244;IBM Corporation;United States;Artificial Intelligence;Information Technology;Next-gen cybersecurity models, Ethical AI funding, AI-powered automation tools;AI-powered automation tools, Decentralized data ownership, Ethical AI funding
ORG000245;Microsoft Corporation;United States;Artificial Intelligence;Information Technology;Quantum networking research, Ethical AI funding, Decentralized data ownership;Decentralized data ownership, Augmented workforce systems, Quantum networking research
ORG000246;NVIDIA Corporation;United States;Artificial Intelligence;Information Technology;Ethical AI funding, Next-gen cybersecurity models, AI-powered automation tools;Augmented workforce systems, Ethical AI funding, Next-gen cybersecurity models
ORG000247;Adobe Inc.;United States;Software & IT Services;Information Technology;Decentralized data ownership, Next-gen cybersecurity models, Augmented workforce systems;Ethical AI funding, Decentralized data ownership, Quantum networking research
ORG000248;Oracle Corporation;United States;Software & IT Services;Information Technology;AI-powered automation tools, Next-gen cybersecurity models, Ethical AI funding;Augmented workforce systems, Next-gen cybersecurity models, AI-powered automation tools
ORG000249;Salesforce Inc.;United States;Software & IT Services;Information Technology;Decentralized data ownership, Quantum networking research, AI-powered automation tools;Ethical AI funding, Decentralized data ownership, AI-powered automation tools
ORG000250;SAP SE;Germany;Software & IT Services;Information Technology;AI-powered automation tools, Augmented workforce systems, Next-gen cybersecurity models;Next-gen cybersecurity models, Augmented workforce systems, Ethical AI funding
ORG000251;Aetna Inc.;United States;Health Insurance;Insurance;Cyber attack response funds, Usage-based premium adjustments, On-demand micro-insurance;Climate disaster coverage models, Blockchain-based claims processing, Real-time risk prediction
ORG000252;Anthem, Inc.;United States;Health Insurance;Insurance;Real-time risk prediction, Climate disaster coverage models, Usage-based premium adjustments;On-demand micro-insurance, Climate disaster coverage models, Blockchain-based claims processing
ORG000253;Cigna Corporation;United States;Health Insurance;Insurance;Cyber attack response funds, Real-time risk prediction, On-demand micro-insurance;Cyber attack response funds, Usage-based premium adjustments, Real-time risk prediction
ORG000254;Humana Inc.;United States;Health Insurance;Insurance;Cyber attack response funds, Real-time risk prediction, On-demand micro-insurance;Cyber attack response funds, Blockchain-based claims processing, Usage-based premium adjustments
ORG000255;MetLife, Inc.;United States;Life Insurance;Insurance;On-demand micro-insurance, Blockchain-based claims processing, Usage-based premium adjustments;Usage-based premium adjustments, Cyber attack response funds, Blockchain-based claims processing
ORG000256;New York Life Insurance Company;United States;Life Insurance;Insurance;Real-time risk prediction, Climate disaster coverage models, Cyber attack response funds;Cyber attack response funds, Real-time risk prediction, Usage-based premium adjustments
ORG000257;Northwestern Mutual;United States;Life Insurance;Insurance;Usage-based premium adjustments, On-demand micro-insurance, Blockchain-based claims processing;On-demand micro-insurance, Cyber attack response funds, Climate disaster coverage models
ORG000258;Prudential Financial, Inc.;United States;Life Insurance;Insurance;Blockchain-based claims processing, Cyber attack response funds, Real-time risk prediction;Usage-based premium adjustments, Blockchain-based claims processing, On-demand micro-insurance
ORG000259;Allstate Corporation;United States;Property & Casualty;Insurance;Blockchain-based claims processing, Climate disaster coverage models, Cyber attack response funds;Real-time risk prediction, Cyber attack response funds, Usage-based premium adjustments
ORG000260;Liberty Mutual Group;United States;Property & Casualty;Insurance;Cyber attack response funds, Blockchain-based claims processing, Usage-based premium adjustments;Cyber attack response funds, On-demand micro-insurance, Blockchain-based claims processing
ORG000261;State Farm Mutual Automobile Insurance Company;United States;Property & Casualty;Insurance;Blockchain-based claims processing, On-demand micro-insurance, Climate disaster coverage models;Climate disaster coverage models, Real-time risk prediction, Usage-based premium adjustments
ORG000262;The Travelers Companies, Inc.;United States;Property & Casualty;Insurance;On-demand micro-insurance, Blockchain-based claims processing, Cyber attack response funds;Real-time risk prediction, Cyber attack response funds, Blockchain-based claims processing
ORG000263;Hannover Re;Germany;Reinsurance;Insurance;Real-time risk prediction, Blockchain-based claims processing, Cyber attack response funds;Blockchain-based claims processing, On-demand micro-insurance, Usage-based premium adjustments
ORG000264;Munich Re;Germany;Reinsurance;Insurance;Climate disaster coverage models, Cyber attack response funds, On-demand micro-insurance;Real-time risk prediction, Climate disaster coverage models, On-demand micro-insurance
ORG000265;Swiss Re;Switzerland;Reinsurance;Insurance;Blockchain-based claims processing, Usage-based premium adjustments, On-demand micro-insurance;Cyber attack response funds, Real-time risk prediction, Blockchain-based claims processing
ORG000266;The Reinsurance Group of America, Incorporated;United States;Reinsurance;Insurance;Cyber attack response funds, On-demand micro-insurance, Usage-based premium adjustments;Cyber attack response funds, Usage-based premium adjustments, Blockchain-based claims processing
ORG000267;A.P. Moller - Maersk;Denmark;Freight & Logistics;Logistics & Transportation;Crowdsourced transport solutions, Hyper-efficient cargo handling, Autonomous warehouse robotics;Urban last-mile delivery networks, Hyper-efficient cargo handling, AI-driven fleet management
ORG000268;C.H. Robinson;United States;Freight & Logistics;Logistics & Transportation;Autonomous warehouse robotics, Predictive supply chain modeling, Hyper-efficient cargo handling;Crowdsourced transport solutions, Predictive supply chain modeling, Autonomous warehouse robotics
ORG000269;Deutsche Post DHL Group;Germany;Freight & Logistics;Logistics & Transportation;Autonomous warehouse robotics, AI-driven fleet management, Hyper-efficient cargo handling;Urban last-mile delivery networks, Autonomous warehouse robotics, Predictive supply chain modeling
ORG000270;Kuehne + Nagel;Switzerland;Freight & Logistics;Logistics & Transportation;Predictive supply chain modeling, Hyper-efficient cargo handling, AI-driven fleet management;Crowdsourced transport solutions, AI-driven fleet management, Urban last-mile delivery networks
ORG000271;CMA CGM Group;France;Shipping & Maritime;Logistics & Transportation;AI-driven fleet management, Urban last-mile delivery networks, Autonomous warehouse robotics;Hyper-efficient cargo handling, Urban last-mile delivery networks, Autonomous warehouse robotics
ORG000272;Hapag-Lloyd;Germany;Shipping & Maritime;Logistics & Transportation;Autonomous warehouse robotics, AI-driven fleet management, Hyper-efficient cargo handling;Autonomous warehouse robotics, Urban last-mile delivery networks, Predictive supply chain modeling
ORG000273;Mediterranean Shipping Company (MSC);Switzerland;Shipping & Maritime;Logistics & Transportation;Hyper-efficient cargo handling, AI-driven fleet management, Autonomous warehouse robotics;Predictive supply chain modeling, AI-driven fleet management, Crowdsourced transport solutions
ORG000274;Ocean Network Express (ONE);Japan;Shipping & Maritime;Logistics & Transportation;Autonomous warehouse robotics, Predictive supply chain modeling, Hyper-efficient cargo handling;Urban last-mile delivery networks, Crowdsourced transport solutions, Autonomous warehouse robotics
ORG000275;BNSF Railway;United States;Rail Freight;Logistics & Transportation;Hyper-efficient cargo handling, Crowdsourced transport solutions, AI-driven fleet management;Hyper-efficient cargo handling, Predictive supply chain modeling, Urban last-mile delivery networks
ORG000276;Canadian National Railway;Canada;Rail Freight;Logistics & Transportation;Urban last-mile delivery networks, Hyper-efficient cargo handling, Autonomous warehouse robotics;Predictive supply chain modeling, AI-driven fleet management, Hyper-efficient cargo handling
ORG000277;CSX Transportation;United States;Rail Freight;Logistics & Transportation;Autonomous warehouse robotics, AI-driven fleet management, Hyper-efficient cargo handling;AI-driven fleet management, Urban last-mile delivery networks, Autonomous warehouse robotics
ORG000278;Union Pacific Railroad;United States;Rail Freight;Logistics & Transportation;Crowdsourced transport solutions, Autonomous warehouse robotics, Urban last-mile delivery networks;Predictive supply chain modeling, Crowdsourced transport solutions, Autonomous warehouse robotics
ORG000279;Cathay Pacific Cargo;Hong Kong;Air Cargo;Logistics & Transportation;Autonomous warehouse robotics, Crowdsourced transport solutions, AI-driven fleet management;AI-driven fleet management, Predictive supply chain modeling, Crowdsourced transport solutions
ORG000280;Emirates SkyCargo;United Arab Emirates;Air Cargo;Logistics & Transportation;Predictive supply chain modeling, Urban last-mile delivery networks, Crowdsourced transport solutions;Urban last-mile delivery networks, Hyper-efficient cargo handling, Predictive supply chain modeling
ORG000281;FedEx Express;United States;Air Cargo;Logistics & Transportation;Predictive supply chain modeling, Urban last-mile delivery networks, Hyper-efficient cargo handling;AI-driven fleet management, Crowdsourced transport solutions, Predictive supply chain modeling
ORG000282;UPS Airlines;United States;Air Cargo;Logistics & Transportation;Crowdsourced transport solutions, Predictive supply chain modeling, Hyper-efficient cargo handling;Crowdsourced transport solutions, Autonomous warehouse robotics, Urban last-mile delivery networks
ORG000283;Bosch Rexroth;Germany;Industrial Machinery;Manufacturing;Hyperlocal manufacturing scaling, Closed-loop recycling systems, Smart factory interoperability;Self-healing material research, Closed-loop recycling systems, AI-driven predictive maintenance
ORG000284;Caterpillar Inc.;United States;Industrial Machinery;Manufacturing;Self-healing material research, AI-driven predictive maintenance, Smart factory interoperability;AI-driven predictive maintenance, Smart factory interoperability, Closed-loop recycling systems
ORG000285;Deere & Company;United States;Industrial Machinery;Manufacturing;AI-driven predictive maintenance, Smart factory interoperability, Closed-loop recycling systems;Carbon-neutral supply chains, Hyperlocal manufacturing scaling, Self-healing material research
ORG000286;Komatsu Ltd.;Japan;Industrial Machinery;Manufacturing;AI-driven predictive maintenance, Self-healing material research, Hyperlocal manufacturing scaling;Smart factory interoperability, Self-healing material research, Carbon-neutral supply chains
ORG000287;Foxconn (Hon Hai Precision Industry Co., Ltd.);Taiwan;Electronics Manufacturing;Manufacturing;Self-healing material research, Hyperlocal manufacturing scaling, Carbon-neutral supply chains;Closed-loop recycling systems, Self-healing material research, AI-driven predictive maintenance
ORG000288;Flex Ltd.;Singapore;Electronics Manufacturing;Manufacturing;Hyperlocal manufacturing scaling, Carbon-neutral supply chains, Closed-loop recycling systems;Hyperlocal manufacturing scaling, Self-healing material research, Carbon-neutral supply chains
ORG000289;Jabil Inc.;United States;Electronics Manufacturing;Manufacturing;Self-healing material research, Closed-loop recycling systems, Smart factory interoperability;Smart factory interoperability, Closed-loop recycling systems, Self-healing material research
ORG000290;Pegatron Corporation;Taiwan;Electronics Manufacturing;Manufacturing;Closed-loop recycling systems, Self-healing material research, Carbon-neutral supply chains;Carbon-neutral supply chains, Hyperlocal manufacturing scaling, AI-driven predictive maintenance
ORG000291;ABB Ltd.;Switzerland;Factory Automation;Manufacturing;Smart factory interoperability, Closed-loop recycling systems, AI-driven predictive maintenance;Self-healing material research, AI-driven predictive maintenance, Closed-loop recycling systems
ORG000292;Emerson Electric Co.;United States;Factory Automation;Manufacturing;AI-driven predictive maintenance, Smart factory interoperability, Carbon-neutral supply chains;Closed-loop recycling systems, AI-driven predictive maintenance, Smart factory interoperability
ORG000293;Rockwell Automation;United States;Factory Automation;Manufacturing;Closed-loop recycling systems, Self-healing material research, AI-driven predictive maintenance;Closed-loop recycling systems, Smart factory interoperability, Self-healing material research
ORG000294;Siemens AG;Germany;Factory Automation;Manufacturing;Self-healing material research, Carbon-neutral supply chains, Closed-loop recycling systems;Closed-loop recycling systems, Carbon-neutral supply chains, AI-driven predictive maintenance
ORG000295;Intel Corporation;United States;Semiconductors;Manufacturing;Closed-loop recycling systems, Self-healing material research, Carbon-neutral supply chains;AI-driven predictive maintenance, Carbon-neutral supply chains, Smart factory interoperability
ORG000296;NVIDIA Corporation;United States;Semiconductors;Manufacturing;Self-healing material research, Carbon-neutral supply chains, Smart factory interoperability;Hyperlocal manufacturing scaling, Smart factory interoperability, Self-healing material research
ORG000297;Samsung Electronics Co., Ltd.;South Korea;Semiconductors;Manufacturing;Carbon-neutral supply chains, Self-healing material research, Smart factory interoperability;Smart factory interoperability, Closed-loop recycling systems, Carbon-neutral supply chains
ORG000298;Taiwan Semiconductor Manufacturing Company (TSMC);Taiwan;Semiconductors;Manufacturing;Carbon-neutral supply chains, AI-driven predictive maintenance, Self-healing material research;Carbon-neutral supply chains, Closed-loop recycling systems, Hyperlocal manufacturing scaling
ORG000299;BuzzFeed;United States;Digital Media;Media & Publishing;Stable Cash Flow, Subscription-Based Revenue Growth, Tax Benefits;Tax Benefits, Low Content Acquisition Costs, Flexible Payment Models
ORG000300;HuffPost;United States;Digital Media;Media & Publishing;Low Content Acquisition Costs, Tax Benefits, Stable Cash Flow;High Advertising Revenue, Flexible Payment Models, Subscription-Based Revenue Growth
ORG000301;Vice Media;United States;Digital Media;Media & Publishing;Flexible Payment Models, Tax Benefits, Subscription-Based Revenue Growth;Flexible Payment Models, Subscription-Based Revenue Growth, Tax Benefits
ORG000302;Vox Media;United States;Digital Media;Media & Publishing;Stable Cash Flow, Subscription-Based Revenue Growth, High Advertising Revenue;High Advertising Revenue, Subscription-Based Revenue Growth, Low Content Acquisition Costs
ORG000303;The New York Times Company;United States;News & Journalism;Media & Publishing;Subscription-Based Revenue Growth, Tax Benefits, High Advertising Revenue;Tax Benefits, High Advertising Revenue, Low Content Acquisition Costs
ORG000304;Gannett Company, Inc.;United States;News & Journalism;Media & Publishing;Tax Benefits, Flexible Payment Models, Subscription-Based Revenue Growth;Tax Benefits, High Advertising Revenue, Stable Cash Flow
ORG000305;News Corp;United States;News & Journalism;Media & Publishing;Subscription-Based Revenue Growth, High Advertising Revenue, Tax Benefits;Flexible Payment Models, Stable Cash Flow, Low Content Acquisition Costs
ORG000306;Thomson Reuters;Canada;News & Journalism;Media & Publishing;Stable Cash Flow, Low Content Acquisition Costs, Flexible Payment Models;Tax Benefits, Low Content Acquisition Costs, High Advertising Revenue
ORG000307;Penguin Random House;United States;Book Publishing;Media & Publishing;Tax Benefits, High Advertising Revenue, Flexible Payment Models;High Advertising Revenue, Low Content Acquisition Costs, Stable Cash Flow
ORG000308;Hachette Livre;France;Book Publishing;Media & Publishing;Tax Benefits, Low Content Acquisition Costs, Stable Cash Flow;Flexible Payment Models, Stable Cash Flow, Low Content Acquisition Costs
ORG000309;HarperCollins;United States;Book Publishing;Media & Publishing;High Advertising Revenue, Flexible Payment Models, Low Content Acquisition Costs;Low Content Acquisition Costs, Stable Cash Flow, Tax Benefits
ORG000310;Macmillan Publishers;United States;Book Publishing;Media & Publishing;Subscription-Based Revenue Growth, Low Content Acquisition Costs, Tax Benefits;Stable Cash Flow, Flexible Payment Models, Subscription-Based Revenue Growth
ORG000311;BBC;United Kingdom;Broadcasting;Media & Publishing;Subscription-Based Revenue Growth, Low Content Acquisition Costs, High Advertising Revenue;Tax Benefits, Subscription-Based Revenue Growth, Flexible Payment Models
ORG000312;CBS Corporation;United States;Broadcasting;Media & Publishing;High Advertising Revenue, Flexible Payment Models, Low Content Acquisition Costs;Flexible Payment Models, Low Content Acquisition Costs, High Advertising Revenue
ORG000313;NBCUniversal;United States;Broadcasting;Media & Publishing;Stable Cash Flow, Low Content Acquisition Costs, High Advertising Revenue;Tax Benefits, Flexible Payment Models, Low Content Acquisition Costs
ORG000314;Sinclair Broadcast Group;United States;Broadcasting;Media & Publishing;Stable Cash Flow, Low Content Acquisition Costs, Flexible Payment Models;Tax Benefits, High Advertising Revenue, Subscription-Based Revenue Growth
ORG000315;ArcelorMittal;Luxembourg;Steel & Aluminum;Mining & Metals;High Commodity Prices, Low Extraction Costs, Favorable Tax Policies;High Commodity Prices, Stable Supply Chain, Long-Term Investment Returns
ORG000316;China Baowu Steel Group;China;Steel & Aluminum;Mining & Metals;High Commodity Prices, Sustainable Profit Margins, Favorable Tax Policies;Sustainable Profit Margins, Low Extraction Costs, Stable Supply Chain
ORG000317;Nippon Steel Corporation;Japan;Steel & Aluminum;Mining & Metals;Long-Term Investment Returns, Stable Supply Chain, High Commodity Prices;Stable Supply Chain, Low Extraction Costs, High Commodity Prices
ORG000318;Rio Tinto;United Kingdom;Steel & Aluminum;Mining & Metals;Favorable Tax Policies, Stable Supply Chain, High Commodity Prices;Stable Supply Chain, High Commodity Prices, Sustainable Profit Margins
ORG000319;Barrick Gold Corporation;Canada;Precious Metals;Mining & Metals;Long-Term Investment Returns, Low Extraction Costs, Sustainable Profit Margins;Long-Term Investment Returns, Low Extraction Costs, Favorable Tax Policies
ORG000320;Newmont Corporation;United States;Precious Metals;Mining & Metals;High Commodity Prices, Sustainable Profit Margins, Long-Term Investment Returns;Sustainable Profit Margins, Long-Term Investment Returns, High Commodity Prices
ORG000321;AngloGold Ashanti;South Africa;Precious Metals;Mining & Metals;High Commodity Prices, Stable Supply Chain, Favorable Tax Policies;High Commodity Prices, Long-Term Investment Returns, Favorable Tax Policies
ORG000322;Kinross Gold Corporation;Canada;Precious Metals;Mining & Metals;Stable Supply Chain, Low Extraction Costs, Favorable Tax Policies;High Commodity Prices, Long-Term Investment Returns, Favorable Tax Policies
ORG000323;China Northern Rare Earth Group High-Tech Co., Ltd.;China;Rare Earth Elements;Mining & Metals;Long-Term Investment Returns, High Commodity Prices, Favorable Tax Policies;Favorable Tax Policies, High Commodity Prices, Low Extraction Costs
ORG000324;Lynas Rare Earths;Australia;Rare Earth Elements;Mining & Metals;Favorable Tax Policies, High Commodity Prices, Stable Supply Chain;Favorable Tax Policies, Stable Supply Chain, High Commodity Prices
ORG000325;MP Materials Corp.;United States;Rare Earth Elements;Mining & Metals;Low Extraction Costs, Sustainable Profit Margins, Long-Term Investment Returns;Low Extraction Costs, High Commodity Prices, Long-Term Investment Returns
ORG000326;Iluka Resources;Australia;Rare Earth Elements;Mining & Metals;Long-Term Investment Returns, Stable Supply Chain, Low Extraction Costs;Long-Term Investment Returns, Low Extraction Costs, Favorable Tax Policies
ORG000327;China Shenhua Energy Company;China;Coal & Minerals;Mining & Metals;Stable Supply Chain, Low Extraction Costs, Sustainable Profit Margins;Low Extraction Costs, Stable Supply Chain, Long-Term Investment Returns
ORG000328;Glencore;Switzerland;Coal & Minerals;Mining & Metals;Sustainable Profit Margins, Low Extraction Costs, Long-Term Investment Returns;Stable Supply Chain, Sustainable Profit Margins, Low Extraction Costs
ORG000329;BHP Group;Australia;Coal & Minerals;Mining & Metals;Long-Term Investment Returns, Low Extraction Costs, Stable Supply Chain;Sustainable Profit Margins, Favorable Tax Policies, Stable Supply Chain
ORG000330;Anglo American plc;United Kingdom;Coal & Minerals;Mining & Metals;Long-Term Investment Returns, Sustainable Profit Margins, High Commodity Prices;Low Extraction Costs, Long-Term Investment Returns, High Commodity Prices
ORG000331;Pfizer Inc.;United States;Biopharmaceuticals;Pharmaceuticals;High Drug Pricing Power, Low Production Costs, Favorable Tax Incentives;Sustainable Profit Margins, Low Production Costs, Favorable Tax Incentives
ORG000332;Johnson & Johnson;United States;Biopharmaceuticals;Pharmaceuticals;Strong Patent Protection, Stable R&D Funding, Sustainable Profit Margins;Sustainable Profit Margins, Low Production Costs, Favorable Tax Incentives
ORG000333;Roche Holding AG;Switzerland;Biopharmaceuticals;Pharmaceuticals;Strong Patent Protection, Low Production Costs, High Drug Pricing Power;Stable R&D Funding, Low Production Costs, Favorable Tax Incentives
