CID;NAME;COUNTRY;INDUSTRY;SECTOR;REQUIREMENTS;PREFERENCES
ORG000120;Unilever;United Kingdom;Packaged Goods;Consumer Goods;AI-driven product recommendations, Minimalist packaging initiatives, Custom manufacturing scaling;Minimalist packaging initiatives, Zero-waste retail programs, AI-driven product recommendations
ORG000121;VF Corporation;United States;Apparel & Footwear;Consumer Goods;Zero-waste retail programs, Biodegradable material R&D, Ethical consumerism trends;Biodegradable material R&D, AI-driven product recommendations, Custom manufacturing scaling
ORG000122;Walmart Inc.;United States;Packaged Goods;Consumer Goods;Biodegradable material R&D, Ethical consumerism trends, AI-driven product recommendations;Zero-waste retail programs, AI-driven product recommendations, Ethical consumerism trends
ORG000123;Coursera;United States;Online Education;Education;Coding & STEM funding, Adaptive curriculum financing, AI tutors for personalization;Adaptive curriculum financing, Coding & STEM funding, AI tutors for personalization
ORG000124;edX;United States;Online Education;Education;Gamification in learning, VR-based training modules, Coding & STEM funding;AI tutors for personalization, Coding & STEM funding, VR-based training modules
ORG000125;Khan Academy;United States;Online Education;Education;Gamification in learning, VR-based training modules, Lifelong learning initiatives;Adaptive curriculum financing, Gamification in learning, Lifelong learning initiatives
ORG000126;Udemy;United States;Online Education;Education;Lifelong learning initiatives, Adaptive curriculum financing, Gamification in learning;Coding & STEM funding, VR-based training modules, Adaptive curriculum financing
ORG000127;Harvard University;United States;Higher Education;Education;Lifelong learning initiatives, AI tutors for personalization, Coding & STEM funding;Gamification in learning, Lifelong learning initiatives, VR-based training modules
ORG000128;Massachusetts Institute of Technology (MIT);United States;Higher Education;Education;VR-based training modules, AI tutors for personalization, Adaptive curriculum financing;VR-based training modules, Coding & STEM funding, Adaptive curriculum financing
ORG000129;Stanford University;United States;Higher Education;Education;Lifelong learning initiatives, AI tutors for personalization, Coding & STEM funding;Gamification in learning, Lifelong learning initiatives, Coding & STEM funding
ORG000130;University of Oxford;United Kingdom;Higher Education;Education;Lifelong learning initiatives, VR-based training modules, Adaptive curriculum financing;VR-based training modules, Gamification in learning, Adaptive curriculum financing
ORG000131;KIPP Foundation;United States;K-12 Schools;Education;VR-based training modules, AI tutors for personalization, Adaptive curriculum financing;AI tutors for personalization, Gamification in learning, VR-based training modules
ORG000132;Success Academy Charter Schools;United States;K-12 Schools;Education;Lifelong learning initiatives, VR-based training modules, Gamification in learning;Coding & STEM funding, Lifelong learning initiatives, Adaptive curriculum financing
ORG000133;Uncommon Schools;United States;K-12 Schools;Education;VR-based training modules, Coding & STEM funding, Adaptive curriculum financing;Adaptive curriculum financing, VR-based training modules, Gamification in learning
ORG000134;YES Prep Public Schools;United States;K-12 Schools;Education;Adaptive curriculum financing, Coding & STEM funding, Gamification in learning;AI tutors for personalization, Adaptive curriculum financing, Lifelong learning initiatives
ORG000135;General Assembly;United States;Workforce Training;Education;Adaptive curriculum financing, VR-based training modules, AI tutors for personalization;Lifelong learning initiatives, Adaptive curriculum financing, VR-based training modules
ORG000136;LinkedIn Learning;United States;Workforce Training;Education;Coding & STEM funding, AI tutors for personalization, Lifelong learning initiatives;Coding & STEM funding, Lifelong learning initiatives, Adaptive curriculum financing
ORG000137;Pluralsight;United States;Workforce Training;Education;Lifelong learning initiatives, VR-based training modules, Gamification in learning;VR-based training modules, Adaptive curriculum financing, Lifelong learning initiatives
ORG000138;Skillsoft;United States;Workforce Training;Education;Adaptive curriculum financing, VR-based training modules, Lifelong learning initiatives;Adaptive curriculum financing, Coding & STEM funding, AI tutors for personalization
ORG000139;BP plc;United Kingdom;Oil & Gas;Energy;AI-driven energy demand modeling, Tidal & wave energy funds, Nuclear fusion research;Nuclear fusion research, Tidal & wave energy funds, AI-driven energy demand modeling
ORG000140;Chevron Corporation;United States;Oil & Gas;Energy;Off-grid renewable solutions, Nuclear fusion research, AI-driven energy demand modeling;Transparent carbon pricing, Off-grid renewable solutions, Nuclear fusion research
ORG000141;ExxonMobil Corporation;United States;Oil & Gas;Energy;Hydrogen fuel scaling, Off-grid renewable solutions, Transparent carbon pricing;Hydrogen fuel scaling, Off-grid renewable solutions, Transparent carbon pricing
ORG000142;Royal Dutch Shell plc;Netherlands;Oil & Gas;Energy;Off-grid renewable solutions, Transparent carbon pricing, Hydrogen fuel scaling;Nuclear fusion research, AI-driven energy demand modeling, Hydrogen fuel scaling
ORG000143;Duke Energy Corporation;United States;Electric Power;Energy;Tidal & wave energy funds, Hydrogen fuel scaling, Nuclear fusion research;AI-driven energy demand modeling, Nuclear fusion research, Hydrogen fuel scaling
ORG000144;Électricité de France S.A. (EDF);France;Electric Power;Energy;Nuclear fusion research, AI-driven energy demand modeling, Transparent carbon pricing;Hydrogen fuel scaling, Off-grid renewable solutions, AI-driven energy demand modeling
ORG000145;NextEra Energy, Inc.;United States;Electric Power;Energy;Tidal & wave energy funds, Off-grid renewable solutions, Transparent carbon pricing;AI-driven energy demand modeling, Transparent carbon pricing, Off-grid renewable solutions
ORG000146;The Southern Company;United States;Electric Power;Energy;Transparent carbon pricing, Off-grid renewable solutions, Nuclear fusion research;AI-driven energy demand modeling, Transparent carbon pricing, Hydrogen fuel scaling
ORG000147;Enel S.p.A.;Italy;Renewable Energy;Energy;AI-driven energy demand modeling, Transparent carbon pricing, Hydrogen fuel scaling;Off-grid renewable solutions, Transparent carbon pricing, AI-driven energy demand modeling
ORG000148;Iberdrola, S.A.;Spain;Renewable Energy;Energy;Hydrogen fuel scaling, Tidal & wave energy funds, Nuclear fusion research;Off-grid renewable solutions, Hydrogen fuel scaling, Tidal & wave energy funds
ORG000149;NextEra Energy, Inc.;United States;Renewable Energy;Energy;Nuclear fusion research, AI-driven energy demand modeling, Tidal & wave energy funds;AI-driven energy demand modeling, Hydrogen fuel scaling, Nuclear fusion research
ORG000150;Ørsted A/S;Denmark;Renewable Energy;Energy;Tidal & wave energy funds, AI-driven energy demand modeling, Nuclear fusion research;Transparent carbon pricing, AI-driven energy demand modeling, Hydrogen fuel scaling
ORG000151;China National Nuclear Corporation (CNNC);China;Nuclear Energy;Energy;Tidal & wave energy funds, Transparent carbon pricing, Off-grid renewable solutions;Tidal & wave energy funds, Hydrogen fuel scaling, Nuclear fusion research
ORG000152;Électricité de France S.A. (EDF);France;Nuclear Energy;Energy;Off-grid renewable solutions, AI-driven energy demand modeling, Tidal & wave energy funds;Off-grid renewable solutions, Transparent carbon pricing, Hydrogen fuel scaling
ORG000153;Rosatom State Atomic Energy Corporation;Russia;Nuclear Energy;Energy;Tidal & wave energy funds, Nuclear fusion research, Transparent carbon pricing;Transparent carbon pricing, Off-grid renewable solutions, AI-driven energy demand modeling
ORG000154;Westinghouse Electric Company;United States;Nuclear Energy;Energy;Off-grid renewable solutions, Nuclear fusion research, Transparent carbon pricing;Nuclear fusion research, Hydrogen fuel scaling, Off-grid renewable solutions
ORG000155;Disney;United States;Film & TV;Entertainment;Blockchain-based royalty tracking, Immersive VR storytelling, NFT-backed digital rights;NFT-backed digital rights, Crowdfunded production platforms, Immersive VR storytelling
ORG000156;NBCUniversal;United States;Film & TV;Entertainment;AI-generated content investment, NFT-backed digital rights, Immersive VR storytelling;Immersive VR storytelling, NFT-backed digital rights, Blockchain-based royalty tracking
ORG000157;Sony Pictures Entertainment;United States;Film & TV;Entertainment;Subscription model diversity, AI-generated content investment, NFT-backed digital rights;Crowdfunded production platforms, Immersive VR storytelling, AI-generated content investment
ORG000158;Warner Bros. Discovery;United States;Film & TV;Entertainment;Blockchain-based royalty tracking, NFT-backed digital rights, Crowdfunded production platforms;Blockchain-based royalty tracking, Crowdfunded production platforms, Immersive VR storytelling
ORG000159;Sony Music Entertainment;United States;Music Industry;Entertainment;Immersive VR storytelling, Blockchain-based royalty tracking, Subscription model diversity;Subscription model diversity, NFT-backed digital rights, Crowdfunded production platforms
ORG000160;Universal Music Group;United States;Music Industry;Entertainment;Crowdfunded production platforms, NFT-backed digital rights, AI-generated content investment;AI-generated content investment, Crowdfunded production platforms, Immersive VR storytelling
ORG000161;Warner Music Group;United States;Music Industry;Entertainment;Subscription model diversity, AI-generated content investment, Blockchain-based royalty tracking;Crowdfunded production platforms, AI-generated content investment, Immersive VR storytelling
ORG000162;Spotify;Sweden;Music Industry;Entertainment;Blockchain-based royalty tracking, AI-generated content investment, Crowdfunded production platforms;Immersive VR storytelling, NFT-backed digital rights, Subscription model diversity
ORG000163;Electronic Arts;United States;Video Games;Entertainment;Subscription model diversity, NFT-backed digital rights, Crowdfunded production platforms;AI-generated content investment, Blockchain-based royalty tracking, NFT-backed digital rights
ORG000164;Nintendo;Japan;Video Games;Entertainment;Blockchain-based royalty tracking, Immersive VR storytelling, Subscription model diversity;AI-generated content investment, Crowdfunded production platforms, NFT-backed digital rights
ORG000165;Sony Interactive Entertainment;Japan;Video Games;Entertainment;Immersive VR storytelling, Subscription model diversity, Blockchain-based royalty tracking;Subscription model diversity, NFT-backed digital rights, AI-generated content investment
ORG000166;Tencent Games;China;Video Games;Entertainment;Crowdfunded production platforms, NFT-backed digital rights, Blockchain-based royalty tracking;Blockchain-based royalty tracking, Crowdfunded production platforms, NFT-backed digital rights
ORG000167;Amazon Prime Video;United States;Streaming Services;Entertainment;Immersive VR storytelling, NFT-backed digital rights, Subscription model diversity;AI-generated content investment, Immersive VR storytelling, Blockchain-based royalty tracking
ORG000168;Disney+;United States;Streaming Services;Entertainment;AI-generated content investment, Blockchain-based royalty tracking, Subscription model diversity;Blockchain-based royalty tracking, AI-generated content investment, Subscription model diversity
ORG000169;Netflix;United States;Streaming Services;Entertainment;Immersive VR storytelling, AI-generated content investment, Subscription model diversity;Immersive VR storytelling, NFT-backed digital rights, Subscription model diversity
ORG000170;HBO Max;United States;Streaming Services;Entertainment;Subscription model diversity, Blockchain-based royalty tracking, Immersive VR storytelling;Blockchain-based royalty tracking, Immersive VR storytelling, Crowdfunded production platforms
ORG000171;Ant Group;China;FinTech;Financial Services;Green investment portfolios, Instant cross-border payments, Microfinance digital expansion;AI-driven financial planning, Instant cross-border payments, Decentralized credit scoring
ORG000172;Bank of America;United States;Banking;Financial Services;Instant cross-border payments, AI-driven financial planning, Microfinance digital expansion;Instant cross-border payments, Predictive risk analysis tools, Green investment portfolios
ORG000173;BlackRock;United States;Asset Management;Financial Services;AI-driven financial planning, Microfinance digital expansion, Decentralized credit scoring;Predictive risk analysis tools, Microfinance digital expansion, Green investment portfolios
ORG000174;Chime;United States;FinTech;Financial Services;Predictive risk analysis tools, Green investment portfolios, Microfinance digital expansion;Microfinance digital expansion, Green investment portfolios, Decentralized credit scoring
ORG000175;Fidelity Investments;United States;Asset Management;Financial Services;Predictive risk analysis tools, Decentralized credit scoring, Microfinance digital expansion;Microfinance digital expansion, Decentralized credit scoring, AI-driven financial planning
ORG000176;JPMorgan Chase & Co.;United States;Banking;Financial Services;Instant cross-border payments, Green investment portfolios, Decentralized credit scoring;AI-driven financial planning, Microfinance digital expansion, Green investment portfolios
ORG000177;Ping An Insurance;China;Insurance;Financial Services;Decentralized credit scoring, AI-driven financial planning, Instant cross-border payments;AI-driven financial planning, Green investment portfolios, Decentralized credit scoring
ORG000178;Prudential plc;United Kingdom;Insurance;Financial Services;Predictive risk analysis tools, Green investment portfolios, Decentralized credit scoring;Predictive risk analysis tools, AI-driven financial planning, Instant cross-border payments
ORG000179;Revolut;United Kingdom;FinTech;Financial Services;Predictive risk analysis tools, Instant cross-border payments, AI-driven financial planning;Instant cross-border payments, Decentralized credit scoring, Green investment portfolios
ORG000180;State Street Global Advisors;United States;Asset Management;Financial Services;Green investment portfolios, AI-driven financial planning, Decentralized credit scoring;Instant cross-border payments, Predictive risk analysis tools, AI-driven financial planning
ORG000181;The Goldman Sachs Group, Inc.;United States;Banking;Financial Services;Decentralized credit scoring, AI-driven financial planning, Green investment portfolios;Predictive risk analysis tools, Instant cross-border payments, AI-driven financial planning
ORG000182;UnitedHealth Group;United States;Insurance;Financial Services;Decentralized credit scoring, Predictive risk analysis tools, Green investment portfolios;Predictive risk analysis tools, Microfinance digital expansion, Decentralized credit scoring
ORG000183;Vanguard Group;United States;Asset Management;Financial Services;Instant cross-border payments, Predictive risk analysis tools, Decentralized credit scoring;Microfinance digital expansion, Green investment portfolios, Decentralized credit scoring
ORG000184;Visa Inc.;United States;FinTech;Financial Services;Green investment portfolios, Microfinance digital expansion, Predictive risk analysis tools;Green investment portfolios, Predictive risk analysis tools, Instant cross-border payments
ORG000185;Wells Fargo & Company;United States;Banking;Financial Services;Microfinance digital expansion, Decentralized credit scoring, AI-driven financial planning;Instant cross-border payments, Predictive risk analysis tools, AI-driven financial planning
ORG000186;Zurich Insurance Group;Switzerland;Insurance;Financial Services;Instant cross-border payments, AI-driven financial planning, Green investment portfolios;Instant cross-border payments, Predictive risk analysis tools, Microfinance digital expansion
ORG000187;Anheuser-Busch InBev;Belgium;Beverage Industry;Food & Beverage;Low Production Costs, Stable Cash Flow, High Profit Margins;Sustainable Growth, Stable Cash Flow, Tax Incentives
ORG000188;Coca-Cola Company;United States;Beverage Industry;Food & Beverage;Low Production Costs, High Profit Margins, Stable Cash Flow;Tax Incentives, Sustainable Growth, Stable Cash Flow
ORG000189;Heineken N.V.;Netherlands;Beverage Industry;Food & Beverage;High Profit Margins, Low Production Costs, Flexible Payment Terms;High Profit Margins, Sustainable Growth, Stable Cash Flow
ORG000190;PepsiCo;United States;Beverage Industry;Food & Beverage;Tax Incentives, Low Production Costs, High Profit Margins;Stable Cash Flow, Flexible Payment Terms, Sustainable Growth
ORG000191;Archer Daniels Midland Company;United States;Food Processing;Food & Beverage;Sustainable Growth, Low Production Costs, Stable Cash Flow;High Profit Margins, Stable Cash Flow, Low Production Costs
ORG000192;Cargill;United States;Food Processing;Food & Beverage;Stable Cash Flow, Flexible Payment Terms, Tax Incentives;Flexible Payment Terms, Low Production Costs, Sustainable Growth
ORG000193;JBS S.A.;Brazil;Food Processing;Food & Beverage;Tax Incentives, Stable Cash Flow, Sustainable Growth;Tax Incentives, Stable Cash Flow, Flexible Payment Terms
ORG000194;Tyson Foods;United States;Food Processing;Food & Beverage;Flexible Payment Terms, High Profit Margins, Sustainable Growth;Flexible Payment Terms, Sustainable Growth, Stable Cash Flow
ORG000195;Conagra Brands;United States;Packaged Foods;Food & Beverage;Low Production Costs, High Profit Margins, Tax Incentives;Tax Incentives, High Profit Margins, Sustainable Growth
ORG000196;General Mills;United States;Packaged Foods;Food & Beverage;Low Production Costs, Sustainable Growth, Stable Cash Flow;Stable Cash Flow, Sustainable Growth, Flexible Payment Terms
ORG000197;Kraft Heinz Company;United States;Packaged Foods;Food & Beverage;Stable Cash Flow, Sustainable Growth, High Profit Margins;High Profit Margins, Flexible Payment Terms, Low Production Costs
ORG000198;Nestlé;Switzerland;Packaged Foods;Food & Beverage;Low Production Costs, Tax Incentives, Stable Cash Flow;Sustainable Growth, Stable Cash Flow, High Profit Margins
ORG000199;McDonald's Corporation;United States;Restaurant Chains;Food & Beverage;Tax Incentives, Low Production Costs, Sustainable Growth;High Profit Margins, Flexible Payment Terms, Stable Cash Flow
ORG000200;Restaurant Brands International;Canada;Restaurant Chains;Food & Beverage;High Profit Margins, Flexible Payment Terms, Low Production Costs;Stable Cash Flow, Sustainable Growth, Low Production Costs
ORG000201;Starbucks Corporation;United States;Restaurant Chains;Food & Beverage;Stable Cash Flow, Low Production Costs, Sustainable Growth;Sustainable Growth, Tax Incentives, Stable Cash Flow
ORG000202;Yum! Brands;United States;Restaurant Chains;Food & Beverage;Tax Incentives, Flexible Payment Terms, Low Production Costs;Sustainable Growth, Low Production Costs, Stable Cash Flow
ORG000203;Cleveland Clinic;United States;Hospitals & Clinics;Healthcare;Affordable specialty treatments, Personalized medicine programs, Wearable health monitoring;Genome sequencing expansion, AI-assisted mental health care, Affordable specialty treatments
ORG000204;HCA Healthcare;United States;Hospitals & Clinics;Healthcare;Personalized medicine programs, AI-assisted mental health care, Home-based chronic care models;Affordable specialty treatments, Personalized medicine programs, Wearable health monitoring
ORG000205;Mayo Clinic;United States;Hospitals & Clinics;Healthcare;Affordable specialty treatments, Home-based chronic care models, Personalized medicine programs;Genome sequencing expansion, Wearable health monitoring, Home-based chronic care models
ORG000206;UnitedHealth Group;United States;Hospitals & Clinics;Healthcare;Personalized medicine programs, Genome sequencing expansion, Affordable specialty treatments;Affordable specialty treatments, Personalized medicine programs, Genome sequencing expansion
ORG000207;AstraZeneca;United Kingdom;Pharmaceuticals;Healthcare;Genome sequencing expansion, Personalized medicine programs, AI-assisted mental health care;Home-based chronic care models, Affordable specialty treatments, Personalized medicine programs
ORG000208;Johnson & Johnson;United States;Pharmaceuticals;Healthcare;Personalized medicine programs, Wearable health monitoring, Affordable specialty treatments;Home-based chronic care models, AI-assisted mental health care, Genome sequencing expansion
ORG000209;Pfizer;United States;Pharmaceuticals;Healthcare;AI-assisted mental health care, Affordable specialty treatments, Home-based chronic care models;Home-based chronic care models, AI-assisted mental health care, Affordable specialty treatments
ORG000210;Roche;Switzerland;Pharmaceuticals;Healthcare;Genome sequencing expansion, Wearable health monitoring, Affordable specialty treatments;Home-based chronic care models, Wearable health monitoring, Personalized medicine programs
ORG000211;Medtronic;Ireland;Medical Devices;Healthcare;Home-based chronic care models, AI-assisted mental health care, Genome sequencing expansion;Affordable specialty treatments, Genome sequencing expansion, Personalized medicine programs
ORG000212;Siemens Healthineers;Germany;Medical Devices;Healthcare;AI-assisted mental health care, Wearable health monitoring, Personalized medicine programs;Home-based chronic care models, AI-assisted mental health care, Personalized medicine programs
ORG000213;Stryker Corporation;United States;Medical Devices;Healthcare;Genome sequencing expansion, Personalized medicine programs, Wearable health monitoring;Affordable specialty treatments, Personalized medicine programs, Genome sequencing expansion
ORG000214;Zimmer Biomet;United States;Medical Devices;Healthcare;Affordable specialty treatments, Home-based chronic care models, AI-assisted mental health care;Affordable specialty treatments, Home-based chronic care models, AI-assisted mental health care
ORG000215;Epic Systems;United States;HealthTech;Healthcare;Genome sequencing expansion, Affordable specialty treatments, Wearable health monitoring;Wearable health monitoring, Genome sequencing expansion, Personalized medicine programs
ORG000216;Philips Healthcare;Netherlands;HealthTech;Healthcare;Personalized medicine programs, Genome sequencing expansion, Affordable specialty treatments;Genome sequencing expansion, AI-assisted mental health care, Home-based chronic care models
ORG000217;Teladoc Health;United States;HealthTech;Healthcare;Affordable specialty treatments, AI-assisted mental health care, Personalized medicine programs;Affordable specialty treatments, Wearable health monitoring, Home-based chronic care models
ORG000218;Zocdoc;United States;HealthTech;Healthcare;Affordable specialty treatments, Wearable health monitoring, Genome sequencing expansion;Genome sequencing expansion, Affordable specialty treatments, Wearable health monitoring
ORG000219;Hilton Hotels & Resorts;United States;Hotels & Resorts;Hospitality;Zero-waste event planning, Wellness tourism incentives, AI concierge services;Blockchain-based booking security, Luxury eco-lodges funding, Wellness tourism incentives
ORG000220;Hyatt Hotels Corporation;United States;Hotels & Resorts;Hospitality;Seamless travel experiences, Zero-waste event planning, Luxury eco-lodges funding;Blockchain-based booking security, Zero-waste event planning, Seamless travel experiences
ORG000221;Marriott International;United States;Hotels & Resorts;Hospitality;Luxury eco-lodges funding, Seamless travel experiences, Zero-waste event planning;Blockchain-based booking security, Zero-waste event planning, Luxury eco-lodges funding
ORG000222;Shangri-La Hotels and Resorts;Hong Kong;Hotels & Resorts;Hospitality;AI concierge services, Luxury eco-lodges funding, Zero-waste event planning;AI concierge services, Luxury eco-lodges funding, Blockchain-based booking security
ORG000223;American Airlines;United States;Airlines;Hospitality;Seamless travel experiences, Zero-waste event planning, Luxury eco-lodges funding;Zero-waste event planning, Luxury eco-lodges funding, Seamless travel experiences
ORG000224;Delta Air Lines;United States;Airlines;Hospitality;Wellness tourism incentives, Blockchain-based booking security, Luxury eco-lodges funding;Seamless travel experiences, Wellness tourism incentives, Luxury eco-lodges funding
ORG000225;Emirates;United Arab Emirates;Airlines;Hospitality;Zero-waste event planning, Seamless travel experiences, Blockchain-based booking security;Seamless travel experiences, Wellness tourism incentives, AI concierge services
ORG000226;Singapore Airlines;Singapore;Airlines;Hospitality;Zero-waste event planning, Seamless travel experiences, Wellness tourism incentives;Wellness tourism incentives, Luxury eco-lodges funding, Zero-waste event planning
ORG000227;Carnival Corporation;United States;Cruise Lines;Hospitality;Seamless travel experiences, Wellness tourism incentives, Blockchain-based booking security;Wellness tourism incentives, AI concierge services, Blockchain-based booking security
ORG000228;MSC Cruises;Switzerland;Cruise Lines;Hospitality;Seamless travel experiences, AI concierge services, Wellness tourism incentives;AI concierge services, Blockchain-based booking security, Luxury eco-lodges funding
